,created,text,fav_count,retw_count,source,index
0,2021-11-09 07:28:30,"La Germania esorta l'Unione europea ad ""agire"" e ad aiutare a fermare il flusso di migranti che attraversano illega… https://t.co/8yi3LFuGGN",75,28,agenzia_ansa,0
1,2021-11-08 13:16:39,VIDEO | L'esodo dei migranti che ha tentato di entrare illegalmente nel territorio polacco dalla Bielorussia è stat… https://t.co/WmTJzub6zi,25,16,agenzia_ansa,0
2,2021-11-09 09:19:21,"Così la #Bielorussia porta i #migranti in Europa
_
Un'inchiesta pubblicata da Deutsche Welle spiega che a Erbil, ne… https://t.co/bZGDcOklHA",9,7,agenzia_italia,0
3,2021-11-08 17:13:53,La crisi al confine polacco con migliaia di #migranti che premono dalla #Bielorussia. Dispiegati 12 mila soldati… https://t.co/9VcQs3Qq8C,15,9,agenzia_italia,0
4,2021-11-09 15:41:22,"Ue: aggressione da regime illegittimo e disperato #Bielorussia #migranti 

https://t.co/W3LOPo2J97",18,8,rainews,0
5,2021-11-09 09:07:31,"Centinaia di #migranti in fuga da Minsk sono ammassati al confine con la #Polonia. Varsavia: ""Sigilliamo i confini.… https://t.co/BfdGcNLHej",19,11,rainews,0
6,2021-11-08 13:21:26,Centinaia di migranti da Bielorussia a confine con Polonia. Varsavia: pronti a difendere frontiera https://t.co/vIixXf2O0T,15,8,rainews,0
7,2021-11-09 15:27:01,"Crisi migranti, Lukashenko: ""Bielorussia non si piegherà davanti a Ue""  https://t.co/Yl9QA4yKdE https://t.co/P3yUeGiLLj",23,5,mediasettgcom24,0
8,2021-11-09 09:02:15,"Polonia, migliaia di migranti al confine con la Bielorussia  #migranti https://t.co/qam79Xzstr https://t.co/giiUqbYDYx",15,9,mediasettgcom24,0
9,2021-11-09 08:20:02,"Migranti, Polonia: crisi al confine minaccia la stabilità Ue   #migrantiaccordoue https://t.co/47CNjKZ62z https://t.co/XFJlCslqMK",9,5,mediasettgcom24,0
10,2021-11-08 11:55:02,"Polonia, centinaia di migranti arrivati al confine dalla Bielorussia  #polonia https://t.co/Dd6352b8SA https://t.co/lzwzXzRF2R",13,6,mediasettgcom24,0
11,2021-11-09 12:23:48,"Polonia, crisi dei migranti: così Lukashenko (e Putin) sfidano l’Europa al confine biel... https://t.co/FGoyiExvSc https://t.co/LAMiuZartj",3,5,corriere,0
12,2021-11-09 12:00:36,Meloni e la frase su migranti e vaccinazione della figlia: bufera sui social https://t.co/7bUQoes954,18,3,corriere,0
13,2021-11-09 11:39:45,Meloni e la frase su migranti e vaccinazione della figlia: bufera sui social https://t.co/6YyBuH1bT8 https://t.co/oVfgqlkJha,12,2,corriere,0
14,2021-11-09 07:49:45,La Polonia respinge centinaia di migranti dalla Bielorussia: «Pronti a difendere la fr... https://t.co/vNG92B38G5 https://t.co/5g9xyxsQvx,5,0,corriere,0
15,2021-11-08 15:46:51,La Polonia respinge centinaia di migranti dalla Bielorussia «Pronti a difendere frontiera» https://t.co/y6Aw0UxHPk,18,7,corriere,0
16,2021-11-08 15:32:45,La Polonia respinge  centinaia di migranti dalla Bielorussia «Pronti a difendere fronti... https://t.co/vNG92B38G5 https://t.co/gc4bhPfDgV,26,5,corriere,0
17,2021-11-09 16:08:12,"Oggi altre centinaia di migranti hanno raggiunto il confine fra Bielorussia e Polonia
https://t.co/GbQXbcXJIw",13,4,ilpost,0
18,2021-11-08 17:06:49,"Ci sono centinaia di migranti al confine tra Bielorussia e Polonia
https://t.co/EzktfU9JdX",28,15,ilpost,0
19,2021-11-09 13:14:12,"Crisi migranti in Bielorussia, cosa sta succedendo. L’Ue: “Vogliamo evitare una crisi umanitaria”

https://t.co/lBMRrcNiVM",4,1,lastampa,-1
20,2021-11-08 12:06:12,"Bielorussia, centinaia di migranti al confine con la Polonia: tensione in Europa https://t.co/Nl4se9krQx",9,9,ilmessaggeroit,-1
21,2021-11-09 07:35:22,"CONFINE UMANO

#ilmanifesto #laprima 

4.000 migranti tra due fuochi. Spinti dal regime bielorusso, cercano di attr… https://t.co/qqrjtkh6H9",82,28,ilmanifesto,-1
22,2021-11-09 13:07:11,"Bielorussia, 4mila migranti al confine polacco. Varsavia: ‘Minsk aiuta a distruggere barriere’. Ue sospende i visti… https://t.co/a0KMp8Hrtj",7,5,fattoquotidiano,-1
23,2021-11-08 10:27:43,"Il dramma dei migranti che si affidano al ""Topo"", treno regionale che attraversa il confine, e per evitare controll… https://t.co/faIaR6P8Zg",7,5,fattoquotidiano,-1
24,2021-11-09 15:00:33,"RT @eziomauro: Video Polonia, continua la crisi dei migranti: in migliaia affollano il confine con la Bielorussia https://t.co/BK5hVenYbW v…",0,7,repubblica,-1
25,2021-11-09 10:16:03,RT @Maumol: Senza un accordo forte sul tema dei migranti l'Ue è destinata ad un domino di crisi incredibili https://t.co/DsuC1gh6t8,0,4,repubblica,-1
26,2021-11-09 10:03:24,"Crisi dei migranti alla frontiera tra Polonia e Bielorussia, i vescovi francesi risarciranno le vittime dei preti p… https://t.co/CsvYJ3WnI1",7,4,internazionale,-1
27,2021-11-09 16:32:21,"Senza test anticovid i migranti non possono salire in aereo. Nessuno può obbligarli, così la procedura di rimpatrio… https://t.co/9nztitjsxU",7,3,ilgiornale,1
28,2021-11-09 14:30:10,"I voli dal medio oriente verso la Bielorussia sono aumentati, arrivano circa mille persone al giorno. I migranti ve… https://t.co/d7SdHFrWIC",9,2,ilfoglio_it,1
29,2021-11-09 08:30:02,"Il traffico di migranti organizzato da Lukashenka dal medio oriente è in aumento, ai confini europei la situazione… https://t.co/BXOASnOWXQ",2,3,ilfoglio_it,1
30,2021-11-08 19:30:04,"Al confine tra #Polonia e #Bielorussia, la situazione è sempre più tesa e il traffico di #migranti organizzato da… https://t.co/FSRbN9SyCG",4,4,ilfoglio_it,1
31,2021-11-08 11:35:02,"Sedici anni al comando. I migranti, la pandemia, l'#Afghanistan e il passaggio di consegne a Olaf Scholz. “Vi abitu… https://t.co/QvXYgz63Tj",8,4,ilfoglio_it,1
32,2021-11-09 10:30:46,"La Bielorussia invia altri migranti in Polonia, tensione al confine. Dall'Ue altre sanzioni https://t.co/ssppn5BsHT",0,1,gazzettino,1
0,2021-11-10 14:18:37,"Il premier polacco Mateusz Morawiecki ha accusato la Bielorussia di ""terrorismo di stato"" per la crisi dei migranti… https://t.co/UorNlzxUB5",15,4,agenzia_ansa,0
1,2021-11-10 11:38:51,"Bielorussia, Merkel chiede a Putin di intervenire su Minsk. ""E' disumano e inaccettabile la strumentalizzare dei migranti"".#ANSA",25,6,agenzia_ansa,0
2,2021-11-10 09:43:14,"La Polonia ha arrestato oltre 50 migranti al confine con la Bielorussia, vicino a Bialowieza dopo che avevano attra… https://t.co/l0teMWMYdE",30,6,agenzia_ansa,0
3,2021-11-10 08:35:28,Due gruppi di migranti sono riusciti a sfondare il recinto della frontiera fra Bielorussia e Polonia attraversando… https://t.co/RHnA8Ytoqr,89,31,agenzia_ansa,0
4,2021-11-11 05:48:01,"Migranti, la Polonia accusa la Bielorussia di ""terrorismo di Stato""  #polonia https://t.co/rNIPgp5ESy https://t.co/UOaZlVru6J",7,5,mediasettgcom24,0
5,2021-11-10 09:40:01,"Migranti, Minsk a Mosca: auspichiamo reazione congiunta per contrastare crisi  #minsk https://t.co/a53d5it0D2 https://t.co/d0i5zJITFP",7,1,mediasettgcom24,0
6,2021-11-10 08:18:01,Migranti penetrano in Polonia: sfondata la recinzione della frontiera con la Bielorussia  #bielorussia… https://t.co/oVSzhqUTij,18,7,mediasettgcom24,0
7,2021-11-10 01:00:00,"Polonia: ""C'è Putin dietro la crisi dei migranti dalla Bielorussia""  #bielorussia https://t.co/lUEx8CdWlz https://t.co/mUsr5mCl3n",11,7,mediasettgcom24,0
8,2021-11-10 13:00:14,"Minsk accusa: ""Forze polacche hanno picchiato alcuni #migranti"". #Bielorussia https://t.co/QfA55viNOv",5,2,adnkronos,0
9,2021-11-11 16:05:02,Mohammed condannato a 142 anni per aver salvato 33 vite di migranti «Ma io rifarei tutto da capo» https://t.co/AUYvTfW2gT,5,1,corriere,0
10,2021-11-11 15:55:46,Mohammed condannato a 142 anni per aver salvato 33 vite di migranti  «Ma io rifarei tu... https://t.co/hFciapc9U2 https://t.co/liuuaPy6Nd,12,6,corriere,0
11,2021-11-10 23:01:32,"«Nie, non si passa», così la Polonia chiude le porte ai migranti spinti dalla Bielorussia https://t.co/v4ku5xubne",6,2,corriere,0
12,2021-11-10 22:39:46,"«Nie, non si passa», così la Polonia chiude le porte ai migranti spinti dalla Bielorussia https://t.co/VajsJTdO5X https://t.co/BqkT2c8JxD",3,0,corriere,0
13,2021-11-10 11:29:24,"L'uso politico dei migranti in Bielorussia
@fulvioscaglione satrapo e zar giocano duro https://t.co/VXvgLWCLSC",11,4,avvenire_nei,0
14,2021-11-10 10:09:20,"RT @lmisculin: Come ci arrivano i migranti in Bielorussia – un articolo che non contiene espressioni come ""ondata"", ""rubinetto umano"", ""dis…",0,12,ilpost,0
15,2021-11-10 09:55:08,"Come ci arrivano i migranti in Bielorussia
https://t.co/jRYrKNf3qA",18,7,ilpost,0
16,2021-11-10 07:17:53,"Un peschereccio con a bordo circa 400 migranti si è incagliato di fronte a Pozzallo, in Sicilia: i soccorsi vanno a… https://t.co/jtck2atGCT",40,5,ilpost,0
17,2021-11-10 19:13:32,"Ocean Viking, i 306 migranti vanno ad Augusta https://t.co/rklMykiCsO",7,1,lastampa,-1
18,2021-11-10 09:35:27,"[In aggiornamento] Sfondata la recinzione alla frontiera fra Bielorussia e Polonia, migranti superano il confine

https://t.co/Drc0Kx2fP5",1,1,lastampa,-1
19,2021-11-10 08:26:25,"Bielorussia-Polonia, sfondata recinzione frontiera. Minsk: «Polizia ha picchiato migranti» https://t.co/gM8q2j2FLj",6,2,ilmessaggeroit,-1
20,2021-11-10 11:48:38,"Migranti, Varsavia accusa: «Regia di Putin» | il manifesto https://t.co/C64w9gjodg",8,4,ilmanifesto,-1
21,2021-11-11 15:34:12,"#Bielorussia, migliaia di migranti bloccati nei boschi, al gelo e senza viveri nel tentativo di entrare nell'Unione… https://t.co/x42bcIbdXu",15,11,fattoquotidiano,-1
22,2021-11-10 12:31:40,RT @ilfattovideo: Altra notte di tempesta per i 306 migranti a bordo della Ocean Viking: la furia delle onde alte due metri – Video https:/…,0,5,fattoquotidiano,-1
23,2021-11-10 10:39:04,"Polonia, 50 migranti arrestati alla frontiera con la Bielorussia: ""Dietro c'è la mano di Putin"" https://t.co/KyRuGON8re",25,7,repubblica,-1
24,2021-11-10 10:38:31,"Crisi migranti, nuovi scontri alla frontiera Polonia-Bielorussia: 50 profughi arrestati, a migliaia nei boschi. Var… https://t.co/tabsbysuAm",6,5,repubblica,-1
25,2021-11-10 12:45:05,"La vita sospesa dei migranti, respinti ai margini della Fortezza Europa. Le foto https://t.co/C0ZWHV7zyv",23,12,huffpostitalia,-1
26,2021-11-10 10:53:03,L'Europa non può andare in ordine sparso sui migranti. Adotti una linea comune https://t.co/QhLZb1CjE1,16,4,huffpostitalia,-1
27,2021-11-10 13:12:02,"I #migranti sfondano il recinto sul confine tra #Bielorussia e #Polonia, 50 arresti. #Lukashenko: ""Non ci inginocch… https://t.co/6cHnrbpU5S",27,8,libero_official,1
28,2021-11-10 12:42:01,Un gruppo di migranti ha attraversato la frontiera che divide Polonia e Bielorussia dopo aver rotto le recinzioni n… https://t.co/V10XUYK3VF,3,1,ilgiornale,1
29,2021-11-11 16:30:08,[VIDEO] L'inferno gelido dei migranti. @Micol_Fla ci racconta cosa sta succedendo al confine tra Bielorussia e Polo… https://t.co/zqjTxN9azk,1,0,ilfoglio_it,1
30,2021-11-11 14:00:33,La Bielorussia usa la vita dei migranti per ricattare l’Unione europea rea di aver condannato Lukashenka per le ele… https://t.co/wSCooPqQI9,4,1,ilfoglio_it,1
31,2021-11-10 08:58:42,"#bielorussia-#polonia, sfondata recinzione della frontiera. Minsk: «La polizia ha picchiato i #migranti» https://t.co/Y1rT0hwnea",4,3,gazzettino,1
32,2021-11-10 19:00:50,Minsk mette l'Ue sotto pressione come ritorsione dopo le sanzioni di Bruxelles. Duemila migranti a ridosso del conf… https://t.co/ZGLBnEThx7,92,41,laveritaweb,1
33,2021-11-10 09:24:06,"Alta tensione tra Polonia e Bielorussia, i migranti sfondano la recinzione della frontiera https://t.co/jfjWim6DVL",0,2,qn_giorno,1
0,2021-11-16 10:45:57,In Polonia gas lacrimogeni contro i migranti al confine #ANSA https://t.co/vSX2LQs6fE,37,25,agenzia_ansa,0
1,2021-11-16 11:45:57,"Scambi di accuse, sanzioni, e fondi da destinare alla gestione dei #migranti: mentre si valutano proposte, le perso… https://t.co/AUOvSxRP0W",10,6,rainews,0
2,2021-11-15 11:35:21,"Oggi il Consiglio #EU dei ministri degli esteri con al centro la crisi #migranti al confine con la #Bielorussia 

https://t.co/VWUTkLVswO",6,4,rainews,0
3,2021-11-13 12:52:00,"Putin: ""Non abbiamo nulla a che fare con la crisi dei #migranti""
https://t.co/F3wXtzGJGW",10,6,rainews,0
4,2021-11-16 14:49:22,"Crisi migranti, Lukashenko: ""Difendere il Paese ma evitare scontri""  #migranti https://t.co/6PWVkhIoRC https://t.co/PwGWLFV8H9",6,2,mediasettgcom24,0
5,2021-11-16 10:20:01,"Polonia, gas lacrimogeni contro i migranti al confine con la Bielorussia  #polonia https://t.co/QImSSddteD https://t.co/3lPL0e85A5",47,11,mediasettgcom24,0
6,2021-11-15 21:58:18,"Migranti, gli Usa pronti a nuove sanzioni contro la Bielorussia  #Bielorussia https://t.co/WBQip6QOqi https://t.co/oDy3vWqVti",16,2,mediasettgcom24,0
7,2021-11-15 16:52:39,"Migranti, la Polonia costruirà un muro al confine con la Bielorussia  #Polonia https://t.co/qcXnZ7Aa1T https://t.co/4inzHI4Vb6",48,19,mediasettgcom24,0
8,2021-11-15 11:24:00,"Migranti, Mattarella: sconcertante quanto avviene a confini Ue  #SergioMattarella https://t.co/mu9HZ47Voo https://t.co/sOn6zQSv0Z",18,4,mediasettgcom24,0
9,2021-11-15 09:05:01,"Bielorussia, Lukashenko: ""Pronti a rimandare migranti in patria""  #lukashenko https://t.co/cdHEYLEGKU https://t.co/BO2Of7Q1vq",11,6,mediasettgcom24,0
10,2021-11-15 08:32:09,"Lecce, 220 migranti sbarcati a Leuca nella notte  #leuca https://t.co/BNyjWJP18l https://t.co/CN8VpZcEZB",10,4,mediasettgcom24,0
11,2021-11-14 17:09:44,"Migranti al confine con la Polonia, Ue a Minsk: ""Inaccettabile""  #migranti https://t.co/AOS5D0piSg https://t.co/54ojQIfsU9",20,5,mediasettgcom24,0
12,2021-11-16 17:28:11,"Migranti. Regole, limiti e violenze: così la richiesta di asilo è una corsa a ostacoli https://t.co/Wvpbc2wrbt",6,5,avvenire_nei,0
13,2021-11-16 15:31:31,"RT @RescueMed: 📰 da leggere oggi in #edicola speciale di @Avvenire_Nei dedicato ai #migranti e ai muri d'Europa, una documentata e coraggio…",0,33,avvenire_nei,0
14,2021-11-16 14:30:47,Al Centro Astalli. Papa Francesco:  la costruzione dei muri anti-migranti è un ritorno al passato https://t.co/Ob6uwqNmzb,36,13,avvenire_nei,0
15,2021-11-16 12:31:07,Se questa è l'Europa. Una cortina di ferro per i migranti https://t.co/e14EyzxXHh (di @nelloscavo,130,61,avvenire_nei,0
16,2021-11-15 18:00:58,I migranti e i muri d'Europa: domani #16novembre in edicola uno speciale di Avvenire https://t.co/8SM4BmpMEj,155,65,avvenire_nei,0
17,2021-11-15 19:07:23,L’Unione Europea imporrà sanzioni alla Bielorussia per aver facilitato l’arrivo di migranti al confine con la Polon… https://t.co/lM6500MEEl,34,3,ilpost,0
18,2021-11-15 07:28:28,"L’Unione Europea sta cercando di fermare i voli di migranti in Bielorussia
https://t.co/CvPnoJaadT",15,3,ilpost,0
19,2021-11-15 10:39:04,"Crisi migranti sul confine Bielorussa-Ue, il Cremlino: la Russia potrebbe aiutare come mediatore https://t.co/DpNYtGmRvK",4,4,lastampa,-1
20,2021-11-14 14:13:35,"Il maltempo non ferma i migranti, in 300 sbarcano a Roccella Jonica. Altri 113 approdano a Lampedusa https://t.co/qwsgZf4aHn",6,2,lastampa,-1
21,2021-11-15 16:47:47,"Migranti, la #polonia costruirà un #muro al confine con la #bielorussia https://t.co/gauxYHnn0Z",4,2,ilmessaggeroit,-1
22,2021-11-13 08:58:53,"La condanna dell'Onu ma al confine i #migranti  continuano a morire per il freddo #Bielorussia 
https://t.co/x5zgqKoyiX",9,5,ilriformista,-1
23,2021-11-13 08:59:26,Arrivano i parà russi. La crisi è sempre meno dei migranti | il manifesto https://t.co/DpryJOJabM,8,5,ilmanifesto,-1
24,2021-11-15 12:37:08,"Migranti, nuove sanzioni Ue alla Bielorussia: “Indagini su compagnie aeree oltre a Belavia”. Lukashenko: “Combatter… https://t.co/WI5T4mhmK2",12,10,fattoquotidiano,-1
25,2021-11-16 08:14:34,"""Un maglione nel deserto l’esca del dittatore”: così Lukashenko ha ingannato i migranti [dal nostro inviato Giampao… https://t.co/wq0xZJBtyT",4,1,repubblica,-1
26,2021-11-16 07:36:35,"""Un maglione nel deserto l’esca del dittatore”: così Lukashenko ha ingannato i migranti https://t.co/qe9V1dZxcs (sc… https://t.co/4rtSEGQEmJ",8,2,repubblica,-1
27,2021-11-15 19:06:10,"RT @eziomauro: Mattarella: ""Migranti al freddo e affamati, sconcertante quanto avviene ai confini dell'Unione"" https://t.co/uZNpPrI0gB via…",0,53,repubblica,-1
28,2021-11-15 18:55:12,"Migranti, la Polonia annuncia la costruzione di un muro al confine con la Bielorussia entro dicembre. Telefonata Me… https://t.co/N7A5IaAKHe",7,5,repubblica,-1
29,2021-11-15 12:48:03,"RT @giusmo1: Mattarella: ""Migranti al freddo e affamati, sconcertante quanto avviene ai confini dell'Unione"" https://t.co/dmH975kkCQ via @r…",0,17,repubblica,-1
30,2021-11-16 11:35:33,"Papa Francesco: ""La costruzione di muri anti-migranti è un ritorno al passato"" https://t.co/CjpBqKFaqP",50,13,huffpostitalia,-1
31,2021-11-16 09:28:05,"Lydia Gall (HRW): ""Bielorussia e Polonia giocano a ping-pong coi migranti"" https://t.co/rjUSUrcO0Y",4,5,huffpostitalia,-1
32,2021-11-16 08:29:33,Dall’Afghanistan l’emergenza migranti passa per Pakistan e Iran https://t.co/c8CIcW6ppe,6,0,huffpostitalia,-1
33,2021-11-16 07:38:52,"Il capo dello Stato parla di Covid, migranti e Pnrr. E respinge le pressioni dello staff https://t.co/1CMtmtRKRm",1,0,ilgiornale,1
34,2021-11-13 12:30:02,La tratta aerea di Minsk non vale il mercato dell’Ue e le compagnie aeree coinvolte nella crisi dei migranti ci rip… https://t.co/w42gpBjFMe,6,3,ilfoglio_it,1
35,2021-11-15 16:50:31,"Migranti, la #polonia costruirà un #muro al confine con la #bielorussia: inizio lavori a dicembre https://t.co/BBwsMOb4AA",2,1,gazzettino,1
36,2021-11-14 12:00:39,Il premier ha bocciato il ministro in mondovisione sui migranti: è il segnale che gestirà lui il rapporto con l'Eur… https://t.co/oVAd22WKm8,419,115,laveritaweb,1
0,2021-11-18 15:35:16,"Polonia, un centinaio di migranti arrestati nella notte. Il G7 chiede alla Bielorussia di porre fine immediatamente… https://t.co/NwsMi1h1Rt",38,19,agenzia_ansa,0
1,2021-11-17 07:21:54,Nuova tragedia di #migranti: 10 morti al largo della Libia https://t.co/mv11BAg17Z #agi,5,9,agenzia_italia,0
2,2021-11-19 16:24:51,"Il governo pensa a una barriera di 2.500 chilometri e a un fossato per provare a fermare l'afflusso di migranti 

https://t.co/LfdeiDjlFN",7,5,rainews,0
3,2021-11-19 12:29:40,"Crisi dei migranti, la tensione resta alta al confine

https://t.co/pHSuinRl8t",11,5,rainews,0
4,2021-11-19 16:19:01,"Migranti, Lukashenko: ""Possibile siano stati aiutati a entrare in Ue""  #Lukashenko https://t.co/YetdCq4Kwl https://t.co/mbPmCrd4L4",6,3,mediasettgcom24,0
5,2021-11-19 15:10:01,"Migranti, Ucraina: costruiremo muro al confine con Bielorussia e Russia  #migranti https://t.co/dtOwnOYxTz https://t.co/nIBCP2iAKj",4,4,mediasettgcom24,0
6,2021-11-18 18:34:01,"Bielorussia: ""Sgomberato un accampamento di migranti al confine polacco""  #Bielorussia https://t.co/6ehJ72OEGF https://t.co/ezM3t5QlyV",8,4,mediasettgcom24,0
7,2021-11-18 17:17:18,"Migranti Bielorussia, ong polacca: morto un bambino di un anno  #migranti https://t.co/ZkNjjNUcGi https://t.co/AUON6iNh4u",16,4,mediasettgcom24,0
8,2021-11-19 08:07:39,"Migranti. Bielorussia, neonato muore per il freddo al confine polacco. Campi sgomberati https://t.co/izihv2w7k7",43,14,avvenire_nei,0
9,2021-11-17 23:30:00,"Il vescovo Staglianò: accanto ai migranti, per restare umani e fratelli tutti https://t.co/tcIG0IAJVu",105,28,avvenire_nei,0
10,2021-11-17 06:02:01,"Assalto alle barriere polacche, idranti e gas lacrimogeni contro i migranti https://t.co/JcSWPOmBKI",13,10,avvenire_nei,0
11,2021-11-20 08:49:36,"Lukashenko ha ammesso che l’esercito bielorusso ha aiutato gruppi di migranti a entrare in Polonia
https://t.co/9dMuTLSe25",14,1,ilpost,0
12,2021-11-18 08:45:47,"La Polonia ha arrestato un centinaio di migranti al confine con la Bielorussia
https://t.co/e4vthelQ4M",11,4,ilpost,0
13,2021-11-18 19:13:08,La Bielorussia sgombera l’accampamento di migranti al confine https://t.co/OvovLk6weG,5,4,lastampa,-1
14,2021-11-18 15:43:33,Putin: “L’Occidente usa la crisi dei migranti per fare pressione su Minsk” https://t.co/uye5y6XTjW,3,1,lastampa,-1
15,2021-11-19 05:47:16,"Morto di freddo a un anno, tragedia tra i migranti: Minsk sgombera il campo https://t.co/ue6Lo4ZIp0",13,7,ilmessaggeroit,-1
16,2021-11-19 17:22:44,"Il leader della Bielorussia Lukashenko alla Bbc dice: ""Possibile che forze Minsk abbiano aiutati i migranti a entra… https://t.co/E9uBbxQWOa",3,6,ilriformista,-1
17,2021-11-18 14:57:34,"Laici dove siete finiti? (di @AngelaAzzaro)
#migranti #Bielorussia #Polonia @Avvenire_Nei 
https://t.co/MvjTjxYwCA",8,4,ilriformista,-1
18,2021-11-18 12:08:50,"“#Lukashenko indegno, usa i migranti come scudi umani, ma i lacrimogeni contro persone in cerca di protezione sono… https://t.co/3ZeuHSwZEv",2,0,ilriformista,-1
19,2021-11-17 13:49:00,"Scontri coi migranti, le guardie usano i cannoni ad acqua. Lavrov attacca Varsavia, la Nato contro Lukashenko. Quel… https://t.co/ukq6Ce29GO",20,13,ilriformista,-1
20,2021-11-20 15:01:04,Minaccia ucraina sui migranti: «Pronti a sparare» | il manifesto https://t.co/le8eVPPfHa,21,12,ilmanifesto,-1
21,2021-11-18 10:55:07,"Bielorussia, l’Ue stanzia 700 mila euro di aiuti umanitari per i migranti | il manifesto https://t.co/NZo1QmXRal",10,2,ilmanifesto,-1
22,2021-11-17 12:31:49,Guerriglia al confine Lacrimogeni contro i migranti | il manifesto https://t.co/mxuzQ35DLJ,16,8,ilmanifesto,-1
23,2021-11-18 18:25:09,"Migranti tra Polonia e Bielorussia, muore bimbo di 1 anno: ritrovato senza vita nel bosco. Minsk sgombera accampame… https://t.co/JbAq60HGKK",17,7,fattoquotidiano,-1
24,2021-11-19 06:58:33,"Rotta su Messina per la Geo Barents, a bordo 186 migranti e 10 cadaveri https://t.co/o0Tkt72ksd",5,6,repubblica,-1
25,2021-11-20 16:00:02,"Il nuovo muro d’Europa. Reportage dalla frontiera tra Polonia e Bielorussia, dove i migranti sono usati dal regime… https://t.co/ZdjmszxN87",20,3,internazionale,-1
26,2021-11-20 09:00:01,"Il nuovo muro d’Europa. Reportage dalla frontiera tra Polonia e Bielorussia, dove i migranti sono usati dal regime… https://t.co/8h33s9DJNr",32,11,internazionale,-1
27,2021-11-19 10:00:03,"Il nuovo muro d’Europa. Reportage dalla frontiera tra Polonia e Bielorussia, dove i migranti sono usati dal regime… https://t.co/MaELvZ5wOA",29,6,internazionale,-1
28,2021-11-18 14:00:02,"Il nuovo muro d’Europa. Reportage dalla frontiera tra Polonia e Bielorussia, dove i migranti sono usati dal regime… https://t.co/6w7VEVTI1w",37,20,internazionale,-1
29,2021-11-17 10:00:26,"Scontri tra soldati armeni e azeri vicino al Nagorno Karabakh, la polizia francese smantella un campo per migranti… https://t.co/50TwPxExSf",6,4,internazionale,-1
30,2021-11-19 15:36:33,"""Abbiamo un cuore, i miei soldati possono aver aiutato migranti ad andare in Ue"" https://t.co/ckQSMeSwZt",6,2,huffpostitalia,-1
31,2021-11-18 17:40:33,"""L'Ue contraddice i suoi principi. Accolga subito i migranti al confine tra Polonia e Bielorussia"" https://t.co/UiZJ72acvB",11,5,huffpostitalia,-1
32,2021-11-18 13:59:03,"""Ho portato cibi e vestiti ai migranti e sono stata insultata"". Il racconto della volontaria di Grodno https://t.co/776Eyti4eB",8,1,huffpostitalia,-1
33,2021-11-17 18:46:06,"Iratxe Garcia Perez: ""Gli idranti contro i migranti non sono un metodo europeo"" https://t.co/biMSTG1wUO",11,2,huffpostitalia,-1
34,2021-11-17 17:23:34,"""In Grecia la detenzione dei migranti è diventata la regola"". La denuncia di Oxfam https://t.co/fGxY3CEkoA",9,2,huffpostitalia,-1
35,2021-11-17 14:07:33,"Decathlon non vende più canoe nel nord della Francia, per fermare i migranti https://t.co/3hs77S9iLV",3,1,huffpostitalia,-1
36,2021-11-18 14:45:19,"Non si limitano a insegnare a leggere e a scrivere ai #migranti, nelle ""Scuole senza permesso"" milanesi si fa anche… https://t.co/8nb3L7lUM1",3,5,ilgiornale,1
37,2021-11-19 06:13:00,"Morto di freddo a un anno, tragedia tra i migranti: Minsk sgombera il campo https://t.co/ywUsDzxjnc",4,0,gazzettino,1
38,2021-11-18 18:14:08,"Dramma #migranti, morto bimbo di un anno al confine fra #Bielorussia e #Polonia. 
https://t.co/17PJBnseml",0,2,qn_giorno,1
0,2021-11-25 12:44:24,"Tra i 27 migranti annegati nella Manica, al largo di Calais, c'erano anche tre bambini e 7 donne, di cui una era in… https://t.co/caqbcl4VAr",33,9,agenzia_ansa,0
1,2021-11-24 17:17:04,"Sono 27, secondo fonti citate dalla tv BFM, i morti nel naufragio di un'imbarcazione di migranti al largo di Calais… https://t.co/ogDwAN9G5h",28,11,agenzia_ansa,0
2,2021-11-26 10:35:23,"Il presidente bielorusso ai migranti: ""Non c'è modo di trattenervi, mettervi sugli aerei e mandarvi a casa se non v… https://t.co/dV6fvrpgFB",7,3,rainews,0
3,2021-11-25 15:42:42,"Almeno 27 vittime nel naufragio di #migranti #Calais 
https://t.co/k6XgtoLkyt",12,13,rainews,0
4,2021-11-24 18:16:39,L'imbarcazione sulla quale si trovavano i migranti era partita con l'intenzione di raggiungere la Gran Bretagna ma… https://t.co/d6J2FvoRhk,8,4,rainews,0
5,2021-11-26 09:05:00,Sea Watch autorizzata a ripararsi nel porto di Augusta con 461 migranti a bordo  #Migranti https://t.co/AOQAKTVYJ7 https://t.co/hDEn1CLhxg,29,4,mediasettgcom24,0
6,2021-11-26 07:38:00,"Migranti, ministro francese annulla l'incontro con l'omologo britannico  #Migranti https://t.co/JS7HV6bXY1 https://t.co/brVDxyVUuO",5,1,mediasettgcom24,0
7,2021-11-25 21:35:01,"Gb, premier Johnson: la Francia si riprenda i migranti della Manica  #manica https://t.co/PxlYp6veWj https://t.co/2pIdMHTJwX",20,7,mediasettgcom24,0
8,2021-11-25 15:10:14,"Alarm Phone: ""Barcone con 430 migranti a rischio naufragio, morti a bordo""  #Migranti https://t.co/lLckbQAv2D https://t.co/r9geD8M07M",13,1,mediasettgcom24,0
9,2021-11-25 08:24:08,"Strage dei migranti nella Manica, Londra: ""Parigi fermi le partenze"" | Macron: ""Il mare non diventi un cimitero""… https://t.co/b0Tdxuy8oo",6,2,mediasettgcom24,0
